{
  "$schema": "http://json-schema.org/draft-07/schema#",
  "$id": "https://example.com/trip-map.schema.json",
  "title": "여행 지도 스키마",
  "description": "여행 지도 데이터 형식 정의",
  "type": "object",
  "required": ["id", "title", "description", "created", "modified", "color", "categories", "labels", "places", "startDate", "endDate", "days"],
  "properties": {
    "id": {
      "type": "string",
      "description": "지도의 고유 식별자"
    },
    "title": {
      "type": "string",
      "description": "지도의 제목"
    },
    "description": {
      "type": "string",
      "description": "지도에 대한 설명"
    },
    "created": {
      "type": "string",
      "format": "date",
      "description": "지도 생성 날짜 (YYYY-MM-DD)"
    },
    "modified": {
      "type": "string",
      "format": "date",
      "description": "지도 수정 날짜 (YYYY-MM-DD)"
    },
    "color": {
      "type": "string",
      "pattern": "^#([A-Fa-f0-9]{6}|[A-Fa-f0-9]{3})$",
      "description": "지도의 대표 색상 (HEX 코드)"
    },
    "categories": {
      "type": "array",
      "items": {
        "$ref": "map-common.schema.json#/definitions/category"
      },
      "description": "지도에서 사용하는 카테고리 목록"
    },
    "labels": {
      "type": "array",
      "items": {
        "$ref": "map-common.schema.json#/definitions/label"
      },
      "description": "지도에서 사용하는 라벨 목록"
    },
    "startDate": {
      "type": "string",
      "format": "date",
      "description": "여행 시작 날짜 (YYYY-MM-DD)"
    },
    "endDate": {
      "type": "string",
      "format": "date",
      "description": "여행 종료 날짜 (YYYY-MM-DD)"
    },
    "transportation": {
      "type": "string",
      "description": "주요 이동 수단"
    },
    "totalBudget": {
      "type": "number",
      "description": "총 예산"
    },
    "days": {
      "type": "array",
      "items": {
        "type": "object",
        "required": ["day", "date", "places"],
        "properties": {
          "day": {
            "type": "integer",
            "description": "여행 일차"
          },
          "date": {
            "type": "string",
            "format": "date",
            "description": "해당 일차의 날짜 (YYYY-MM-DD)"
          },
          "places": {
            "type": "array",
            "items": {
              "type": "object",
              "required": ["placeId", "order"],
              "properties": {
                "placeId": {
                  "type": "string",
                  "description": "방문 장소의 ID (places 배열에 있는 장소의 ID)"
                },
                "order": {
                  "type": "integer",
                  "description": "해당 일차 내에서의 방문 순서"
                },
                "memo": {
                  "type": "string",
                  "description": "해당 장소 방문에 대한 메모"
                },
                "timeEstimate": {
                  "type": "string",
                  "description": "예상 방문 시간 (HH:MM 형식)",
                  "pattern": "^([0-1]?[0-9]|2[0-3]):[0-5][0-9]$"
                },
                "transportation": {
                  "type": "string",
                  "description": "이전 장소에서 이동 수단"
                }
              },
              "additionalProperties": false
            }
          },
          "memo": {
            "type": "string",
            "description": "해당 일차에 대한 메모"
          }
        },
        "additionalProperties": false
      },
      "description": "여행 일정"
    },
    "places": {
      "type": "array",
      "items": {
        "$ref": "map-common.schema.json#/definitions/place"
      },
      "description": "지도에 포함된 장소 목록"
    }
  },
  "additionalProperties": false
} 